{
  "name": "Env Variables in LXC",
  "description": "Sets environment variables in an LXC container configuration.\n\nFor each environment variable entry (key=value format, one per line), sets the environment variable in the container configuration file.\n\nThe environment variables are stored as comments in the container configuration file and can be read later if needed.\n\nThis template can be called independently of the LXC container's state (running or stopped) and is safe to call multiple times (idempotent).",
  "execute_on": "ve",
  "skip_if_all_missing": ["envs"],
  "parameters": [
    {
      "id": "vm_id",
      "name": "ID of the LXC Container",
      "type": "string",
      "required": true,
      "description": "ID of the LXC container for which environment variables will be set."
    },
    {
      "id": "envs",
      "name": "Environment Variables",
      "type": "string",
      "advanced": true,
      "description": "Environment variables in key=value format, one per line. Each line sets an environment variable in the container configuration. Example:\nMYAPP_HOST=localhost\nMYAPP_PORT=8080\nDATABASE_URL=postgresql://localhost:5432/mydb"
    }
  ],
  "commands": [
    {
      "script": "setenv-vars-in-lxc.sh",
      "description": "Executes the script to set environment variables in the container configuration."
    }
  ]
}



