{
  "execute_on": "ve",
  "name": "Modbus2Mqtt Parameters",
  "description": "Set application-specific parameters for Modbus2Mqtt",
  "parameters": [
    {
      "id": "hostname",
      "name": "OS Hostname",
      "type": "string",
      "default": "modbus2mqtt",
      "required": true,
      "description": "Hostname for the Modbus2Mqtt OS"
    },
    {
      "id": "username",
      "name": "OS Username",
      "type": "string",
      "default": "modbus2mqtt",
      "required": true,
      "advanced": true,
      "description": "Username for the Modbus2Mqtt OS"
    }, 
    {
      "id": "packageurl",
      "name": "URL of the APK package",
      "type": "string",
      "default": "",
      "required": true,
      "description": "URL of the APK package to be installed"
    },
    {
      "id": "packagerpubkeyurl",
      "name": "URL of the public key for verifying the package",
      "type": "string",
      "required": true,
      "description": "URL of the public key for verifying the package"
    },
    {
      "id": "storage_selection",
      "name": "Storage Selection",
      "type": "enum",
      "required": false,
      "enumValuesTemplate": "list-available-storage.json",
      "description": "Select storage to mount. Volumes will be created at <host_mountpoint>/volumes/<hostname>/<volume-key>. If not provided, volumes will be created under /mnt/volumes/<hostname>/<volume-key>.",
      "advanced": true
    },
    {
      "id": "uid",
      "name": "UID",
      "type": "string",
      "default": "1000",
      "description": "UID for the user and mount permissions. Will be used consistently on VE host and LXC container.",
      "advanced": true
    },
    {
      "id": "gid",
      "name": "GID",
      "type": "string",
      "default": "1000",
      "description": "GID for the user and mount permissions. Will be used consistently on VE host and LXC container.",
      "advanced": true
    },
    {
      "id": "usb_bus_device",
      "name": "USB Serial Port",
      "type": "enum",
      "required": false,
      "enumValuesTemplate": "list-host-usb-serial-ports.json",
      "description": "Select USB serial port to map to the container. Format: bus:device (e.g., 1:3). The port will be mapped as /dev/ttyUSB0 in the container."
    }
  ],
  "commands": [
    {
      "properties": [
        { "id": "ostype", "value": "alpine" },
        { "id": "volumes", "value": "data=/data\nconfig=/config\nssl=/ssl" },
        { "id": "packages", "value": "nodejs npm git openrc" }
      ]
    }
  ]
}
