{
  "execute_on": "ve",
  "name": "Set homeassistant DB params",
  "description": "Set parameters for homeassistant database creation",
 
  "commands": [
    {
    "properties": [
        {
          "id": "db_user",
          "value": "homeassistant"
        },
        {
          "id": "db_password",
          "value": "homeassistant"
        },
        {
          "id": "db_name",
          "value": "homeassistant"
        }
            ]
    }
  ]
}
