{
  "execute_on": "ve",
  "name": "Set Parameters",
  "description": "Set application-specific parameters for Mariadb",
  "parameters": [],
  "commands": [
    {
      "name": "set-properties",
      "properties": [
        {
          "id": "hostname",
          "value": "mariadb"
        },
        {
          "id": "oci_image",
          "value": "mariadb"
        },
        {
          "id": "uid",
          "value": "0"
        },
        {
          "id": "username",
          "value": "root"
        },
        {
          "id": "volumes",
          "value": "data=/var/lib/mysql"
        }
      ]
    }
  ]
}