{
  "execute_on": "ve",
  "name": "Set dynamic_prices DB params",
  "description": "Set parameters for dynamic_prices database creation",
 
  "commands": [
    {
    "properties": [
        {
          "id": "db_user",
          "value": "dynamic_prices"
        },
        {
          "id": "db_password",
          "value": "dynamic_prices"
        },
        {
          "id": "db_name",
          "value": "dynamic_prices"
        }
            ]
    }
  ]
}
