{
  "name": "Mount Disk on Host",
  "description": "Mounts a block device (by UUID) on the Proxmox host.\n\nThis template only mounts the device on the host. To bind mount it into a container, use the bind-host template afterwards.\n\nThis template can be called independently and is safe to call multiple times (idempotent).",
  "execute_on": "ve",
  "skip_if_property_set": "skip_mount_disk_on_host",
  "parameters": [
    {
      "id": "storage_selection",
      "name": "Storage Selection",
      "type": "enum",
      "required": true,
      "enumValuesTemplate": "list-available-storage.json",
      "description": "Select storage to mount. Only filesystems prefixed with 'uuid:' are supported."
    },
    {
      "id": "uid",
      "name": "UID for mount directory",
      "type": "string",
      "default": "0",
      "advanced": true,
      "description": "Optional: UID to set for the mount directory. Default is 0 (root)."
    },
    {
      "id": "gid",
      "name": "GID for mount directory",
      "type": "string",
      "default": "0",
      "advanced": true,
      "description": "Optional: GID to set for the mount directory. Default is 0 (root)."
    }
  ],
  "commands": [
    {
      "script": "mount-disk.sh",
      "description": "Executes the script to mount the disk by UUID on the host.",
      "outputs": ["host_mountpoint"]
    }
  ]
}
