{
  "execute_on": "ve",
  "name": "Backup Share Parameters",
  "description": "Set application-specific parameters for Mac OS Time Machine Backup Server",
  "parameters": [
    {
      "id": "hostname",
      "name": "Hostname",
      "type": "string",
      "default": "nas",
      "required": true,
      "description": "Hostname for the NAS Server container"
    },
    {
      "id": "username",
      "name": "Username",
      "type": "string",
      "default": "nas",
      "required": true,
      "description": "Username for the NAS Server container"
    },
    {
      "id": "password",
      "name": "Password",
      "type": "string",
      "description": "The password for the Samba user.",
      "required": true,
      "secure": true
    },
    {
      "id": "uid",
      "name": "UID",
      "type": "string",
      "default": "1000",
      "description": "UID for the user and mount permissions. Will be used consistently on VE host and LXC container.",
      "advanced": true
    },
    {
      "id": "gid",
      "name": "GID",
      "type": "string",
      "default": "1000",
      "description": "GID for the user and mount permissions. Will be used consistently on VE host and LXC container.",
      "advanced": true
    }
  ],
  "commands": [
    {
      "properties": [
        { "id": "ostype", "value": "debian" },
        { "id": "allow-guest", "value": true },
        { "id": "skip_mount_disk_on_host", "value": true },
        { "id": "skip_bind_multiple_volumes_to_lxc", "value": true },
        { "id": "packages", "value": "samba avahi-daemon" },
        { "id": "volumes", "value": "nas=/var/nas" }
      ]
    }
  ]
}
